{
  "$schema":"https://json-schema.org/draft/2020-12/schema","type":"object","additionalProperties":false,
  "required":["schema_version","status","decision_date","decision_source","current_freeze","primary_next_pilot","affordability_contingency","new_language_governance_preparation","analysis_extensions","controls"],
  "properties":{
    "schema_version":{"const":"next-language-pilot-plan-v1"},"status":{"const":"prospective_planning_only_new_freeze_required"},"decision_date":{"const":"2026-08-12"},"decision_source":{"const":"repository_maintainer_user_instruction"},
    "current_freeze":{"type":"object","additionalProperties":false,"required":["freeze_id","languages","changed","rule"],"properties":{"freeze_id":{"const":"g3-option-b-es-ja-20260812-v1"},"languages":{"const":["es","ja"]},"changed":{"const":false},"rule":{"type":"string","minLength":1}}},
    "primary_next_pilot":{"type":"object","additionalProperties":false,"required":["pilot_id","languages","design_role","selection_rationale","source_profiles","required_gates","execution_authorized"],"properties":{"pilot_id":{"const":"option-b-fr-cs-next"},"languages":{"const":["fr","cs"]},"design_role":{"const":"next_two_language_pilot"},"selection_rationale":{"type":"string","minLength":1},"source_profiles":{"type":"array","minItems":2,"maxItems":2,"items":{"$ref":"#/$defs/profile"}},"required_gates":{"type":"array","minItems":7,"uniqueItems":true,"items":{"type":"string"}},"execution_authorized":{"const":false}}},
    "affordability_contingency":{"type":"object","additionalProperties":false,"required":["expansion_id","additional_languages","full_language_set","activation_rule","affordability_evidence_required","source_profiles","fallback_if_unaffordable","execution_authorized","financial_spend_authorized"],"properties":{"expansion_id":{"const":"option-four-fr-cs-nl-tr"},"additional_languages":{"const":["nl","tr"]},"full_language_set":{"const":["fr","cs","nl","tr"]},"activation_rule":{"type":"string","minLength":1},"affordability_evidence_required":{"type":"array","minItems":7,"uniqueItems":true,"items":{"type":"string"}},"source_profiles":{"type":"array","minItems":2,"maxItems":2,"items":{"$ref":"#/$defs/profile"}},"fallback_if_unaffordable":{"type":"string","minLength":1},"execution_authorized":{"const":false},"financial_spend_authorized":{"const":false}}},
    "new_language_governance_preparation":{"type":"array","minItems":2,"maxItems":2,"items":{"type":"object","additionalProperties":false,"required":["language","name","study_role","local_hpo_payload_status","metadata_pathways","preparation_tasks","payload_retrieval_authorized","translation_rows_authorized","empirical_use_authorized"],"properties":{"language":{"enum":["pl","uk"]},"name":{"enum":["Polish","Ukrainian"]},"study_role":{"const":"first_new_language_candidate"},"local_hpo_payload_status":{"const":"absent"},"metadata_pathways":{"type":"array","minItems":5,"uniqueItems":true,"items":{"type":"string"}},"preparation_tasks":{"type":"array","minItems":6,"uniqueItems":true,"items":{"type":"string"}},"payload_retrieval_authorized":{"const":false},"translation_rows_authorized":{"const":false},"empirical_use_authorized":{"const":false}}}},
    "analysis_extensions":{"type":"array","minItems":5,"maxItems":5,"items":{"type":"object","additionalProperties":false,"required":["analysis_id","scope","question","status"],"properties":{"analysis_id":{"pattern":"^N[1-5]_[a-z0-9_]+$"},"scope":{"type":"array","minItems":2,"uniqueItems":true,"items":{"enum":["fr","cs","nl","tr","pl","uk"]}},"question":{"type":"string","minLength":1},"status":{"type":"string","minLength":1}}}},
    "controls":{"type":"object","additionalProperties":false,"required":["current_g3_changed","source_payload_retrieval_authorized","translation_rows_added","agent_execution_authorized","financial_spend_authorized","external_contact_authorized","remote_upload_authorized","automatic_promotion_allowed","new_freeze_required"],"properties":{"current_g3_changed":{"const":false},"source_payload_retrieval_authorized":{"const":false},"translation_rows_added":{"const":false},"agent_execution_authorized":{"const":false},"financial_spend_authorized":{"const":false},"external_contact_authorized":{"const":false},"remote_upload_authorized":{"const":false},"automatic_promotion_allowed":{"const":false},"new_freeze_required":{"const":true}}}
  },
  "$defs":{"profile":{"type":"object","additionalProperties":false,"required":["language","babelon_rows","synonym_rows","babelon_blob","synonym_blob","source_status","special_gate"],"properties":{"language":{"enum":["fr","cs","nl","tr"]},"babelon_rows":{"type":"integer","minimum":1},"synonym_rows":{"type":"integer","minimum":1},"babelon_blob":{"pattern":"^[0-9a-f]{40}$"},"synonym_blob":{"pattern":"^[0-9a-f]{40}$"},"source_status":{"type":"string","minLength":1},"special_gate":{"type":"string","minLength":1}}}}
}
